{
  "$schema": "https://json-schema.org/draft/2020-12/schema",
  "title": "Employee",
  "type": "object",
  "properties": {
    "id": {
      "type": "string"
    },
    "number": {
      "type": "string"
    },
    "displayName": {
      "type": "string"
    },
    "givenName": {
      "type": "string"
    },
    "middleName": {
      "type": "string"
    },
    "surname": {
      "type": "string"
    },
    "jobTitle": {
      "type": "string"
    },
    "addressLine1": {
      "type": "string"
    },
    "addressLine2": {
      "type": "string"
    },
    "city": {
      "type": "string"
    },
    "state": {
      "type": "string"
    },
    "country": {
      "type": "string"
    },
    "postalCode": {
      "type": "string"
    },
    "phoneNumber": {
      "type": "string"
    },
    "mobilePhone": {
      "type": "string"
    },
    "email": {
      "type": "string"
    },
    "personalEmail": {
      "type": "string"
    },
    "employmentDate": {
      "type": "string"
    },
    "terminationDate": {
      "type": "string"
    },
    "status": {
      "type": "string"
    },
    "birthDate": {
      "type": "string"
    },
    "statisticsGroupCode": {
      "type": "string"
    },
    "lastModifiedDateTime": {
      "type": "string"
    }
  }
}